{
  "$schema": "https://json-schema.org/draft/2020-12/schema",
  "title": "ResponderDecision",
  "description": "Schema for the headless responder agent's output. The agent proposes exactly one action based on the evidence packet.",
  "type": "object",
  "required": ["incident_id", "confidence", "action", "rationale", "evidence_summary"],
  "properties": {
    "incident_id": {
      "type": "string",
      "description": "The incident identifier, taken from the evidence packet."
    },
    "confidence": {
      "type": "number",
      "minimum": 0.0,
      "maximum": 1.0,
      "description": "The agent's confidence in the proposed root cause. High confidence (>= 0.8) supports a rollback or fix; lower confidence should escalate."
    },
    "action": {
      "type": "string",
      "enum": ["rollback", "fix", "escalate"],
      "description": "The proposed action. Only 'rollback' or 'fix' are actionable by the automation layer; 'escalate' hands the packet to a human."
    },
    "rationale": {
      "type": "string",
      "maxLength": 2000,
      "description": "Explanation of the root cause analysis and why this action was chosen. Reference lines in the evidence packet."
    },
    "evidence_summary": {
      "type": "object",
      "required": ["commits_since_deploy", "error_rate_change", "suspicious_changes"],
      "properties": {
        "commits_since_deploy": {
          "type": "array",
          "items": { "type": "string" },
          "description": "Commits that landed since the last known-good deployment."
        },
        "error_rate_change": {
          "type": "string",
          "description": "Summary of error rate changes observed (e.g., '5xx rate on /api/v1/tasks jumped from 0% to 25%')."
        },
        "suspicious_changes": {
          "type": "array",
          "items": { "type": "string" },
          "description": "Specific files or patterns in the diff that correlate with the error rate change."
        }
      }
    }
  }
}
